"paragraph","nrc_sentiment","no_of_interactions","sentence_id","joy","anticipation","surprise","trust","anger","sadness","disgust","fear","Valence","Arousal","Dominance"
" Lucius then barges into Minerva 's office , outraged that Albus has returned to the school after being dismissed . Albus calmly responds that the governors had asked Lucius to return once they heard that Arthur 's daughter was attacked . Apparently they had been blackmailed by Draco to vote for Albus 's dismissal in the first place under Draco 's threat of cursing their families . Dobby follows Lucius into the room , thus showing that Lucius 's masters are Draco .",-0.825,4," 248 249 250 251",0.1176470588,0.0588235294,0.1176470588,0.1176470588,0.2352941176,0.1176470588,0.1176470588,0.1176470588,0.35919,-0.88113,0.3929
" Albus and Draco have a calm but venomous interchange -LRB- respectively -RRB- , during which Albus and Harry -LRB- with the help of Dobby 's unspoken hints -RRB- essentially expose Lucius sneaking Riddle 's diary -LRB- one of his illegal artefacts -RRB- into Ginevra 's school things during the fight with Arthur at Flourish and Blotts .",-1.35,1," 252",0.05,0.1,0.05,0.15,0.2,0.1,0.1,0.25,0.33625,-0.48062,0.57188
" This is supposed to frame Ginevra for the attacks , with heavy implications on the Muggle Protection Act Arthur has been suggesting .",0.3,1," 253",0,0,0,0,0,0,0,0,0.30455,-0.955,0.28682
" Draco dares Albus to prove Draco 's accusation , and while the Headmaster has insufficient evidence to do that , Draco cautions Draco against orchestrating any further such plots , otherwise Draco is certain that Arthur would do whatever it took to trace it back to Draco . Knowing that a master can release his house-elf by giving them some clothes , Harry tricks Draco into freeing Dobby by giving Draco one of his own socks , which Harry promptly throws away to be caught by Dobby .",0.875,2," 254 255",0,0,0,0,0.4285714286,0.1428571429,0.2857142857,0.1428571429,0.55145,-1.09645,0.36548
" Draco 's retribution is thwarted by the now free Dobby , who then thanks Harry profusely and disappears .",-0.3,1," 256",0,0,0,0,0.4,0.4,0,0.2,0.93,-0.688,0.768
" The petrified people are cured , Rubeus is released from Azkaban , Gilderoy is sent to a hospital and Lucius Draco is fired from his post as school governor .",-1,1," 257",0,0,0,0.6,0,0.2,0,0.2,0.54607,-0.84679,0.34714
" The book ends with Harry at King 's Cross , crossing the barrier back to the Muggle world .",-0.4,1," 258",0,0,0,0,0.5,0.3333333333,0,0.1666666667,0.57,-1.30125,-0.0425
